{
    "programName" : "dam_hazard_analysis",
    "$schema": "tasks.schema.json",
    "itemName" : "${WORK_ITEM}",
    "supportedModes" : ["full", "haz-only", "post"],
    "fetch" : [
        {
            "name" : "get-fault-files",
            "bucket" : "${BUCKET_NAME}",
            "key" : "input/faultfiles.7z",
            "dest" : "./faultfiles.7z",
            "expand" : true
        },
        {
            "name" : "get-input-files",
            "bucket" : "${BUCKET_NAME}",
            "key" : "input/${WORK_ITEM}.7z",
            "dest" : "./Sites/${WORK_ITEM}.7z",
            "expand" : true
        },
        {
            "name" : "get-prior-haz-output",
            "includeWhenMode" : "post",
            "bucket" : "${BUCKET_NAME}",
            "key" : "output/${WORK_ITEM}.7z",
            "dest" : "./Output/${WORK_ITEM}.7z",
            "expand" : true,
            "excludeFilePattern" : ["GMC*", "SSC*", "Tornado*", "deter*", "Fract*" , "Disagg*"]
        },
        {
            "name" : "get-prior-haz-out1",
            "includeWhenMode" : "post",
            "bucket" : "${BUCKET_NAME}",
            "key" : "output/${WORK_ITEM}_out1.7z",
            "dest" : "./Output/${WORK_ITEM}_out1.7z",
            "expand" : true
        }
    ],
    "tasks": [
        {
            "name" : "haz",
            "excludeWhenMode" : "post",
            "command" : "echo '0\n0\n[INPUT_FILE_PATH]' | /opt/haz/haz",
            "inputFolder" : "./Sites/${WORK_ITEM}",
            "inputFilePattern" : "haz.in",
            "outputFolder" : "./Output/${WORK_ITEM}"
        },
        {
            "name" : "haz-back-only",
            "excludeWhenMode" : "post",
            "command" : "echo '0\n0\n[INPUT_FILE_PATH]' | /opt/haz/haz",
            "inputFolder" : "./Sites/",
            "inputFilePattern" : "hazbackonly.in",
            "outputFolder" : "./Output/${WORK_ITEM}"
        },
        {
            "name" : "fractiles",
            "excludeWhenMode" : "haz-only",
            "command" : "echo '[INPUT_FILE_PATH]' | /opt/haz/haz-fractiles",
            "inputFolder" : "./Sites/${WORK_ITEM}",
            "inputFilePattern" : "fractile.in",
            "outputFolder" : "./Output/${WORK_ITEM}"
        },
        {
            "name" : "disagg",
            "excludeWhenMode" : "haz-only",
            "command" : "echo '[INPUT_FILE_PATH]' | /opt/haz/haz-uhs-disagg",
            "inputFolder" : "./Sites/${WORK_ITEM}",
            "inputFilePattern" : "deagg.in",
            "outputFolder" : "./Output/${WORK_ITEM}"
        },
        {
            "name" : "haz-deter",
            "excludeWhenMode" : "haz-only",
            "command" : "echo '0\n3\n[INPUT_FILE_PATH]' | /opt/haz/haz",
            "inputFolder" : "./Sites/${WORK_ITEM}",
            "inputFilePattern" : "deter.in",
            "outputFolder" : "./Output/${WORK_ITEM}"
        },
        {
            "name" : "haz-tornado-gmc",
            "excludeWhenMode" : "haz-only",
            "command" : "echo '0\n[INPUT_FILE_PATH]' | /opt/haz/haz-tornado-gmc",
            "inputFolder" : "./Sites/${WORK_ITEM}",
            "inputFilePattern" : "gmctornado.txt",
            "outputFolder" : "./Output/${WORK_ITEM}"
        },
        {
            "name" : "haz-tornado-ssc",
            "excludeWhenMode" : "haz-only",
            "command" : "echo '[INPUT_FILE_PATH]' | /opt/haz/haz-tornado-ssc",
            "inputFolder" : "./Sites/${WORK_ITEM}",
            "inputFilePattern" : "ssctornado.txt",
            "outputFolder" : "./Output/$Dam{SITE_NAME}/Period${PERIOD_ID}"
        }
    ],
    "move" : [
        {
            "name" : "move-haz-log-files",
            "inputFolder" : "./Sites/${WORK_ITEM}",
            "includeFilePattern" : ["*.log"],
            "outputFolder" : "./Output/${WORK_ITEM}",
            "exitOnError": false
        },
        {
            "name" : "move-out1-files",
            "inputFolder" : "./Output/${WORK_ITEM}",
            "includeFilePattern" : ["*.out1"],
            "outputFolder" : "/tmp/Output/${WORK_ITEM}",
            "exitOnError": false
        }
    ],
    "store" : [
        {
            "name" : "store-main-output",
            "bucket" : "${BUCKET_NAME}",
            "source" : "./Output/${WORK_ITEM}",
            "dest" : "output/${WORK_ITEM}.7z",
            "compress" : true,
            "removeOnStore" : false
        },
        {
            "name" : "store-out1-files",
            "excludeWhenMode" : "post",
            "bucket" : "${BUCKET_NAME}",
            "source" : "/tmp/Output/${WORK_ITEM}",
            "dest" : "output/${WORK_ITEM}_out1.7z",
            "compress" : true,
            "removeOnStore" : true,
            "exitOnError": false
        },
        {
            "name" : "store-logs",
            "bucket" : "${BUCKET_NAME}",
            "source" : "./Logs/",
            "dest" : "logs/${WORK_ITEM}.7z",
            "compress" : true,
            "removeOnStore" : false,
            "exitOnError": false,
            "required": true
        }
    ]
}
